name,location,location_updated,review_title,review_content,date,date_updated,helpful_vote,vote_count,products_used,consumer_tips,overall_rating,service_rating,value_rating,shipping_rating,returns_rating,quality_rating
Rizzy K.,GB 1 review 3 helpful votes,GB,Worst company,Tried to deliver to wrong address left a pick up card at wrong address my neighbour from across road. When I contacted Nike they had no clue contacted Evri they had no clue what had happened or why my parcel was left 5miles away at a shop from my address they told me a investigation would take place with them selves and Nike and I have to pick up my item or start a return. So I started a return with Nike then my neighbour goes and picks up my parcel a few days later thinking it's his having no name or address on card when he saw my name on parcel he was very angry driving so far out the way realising it's not even his parcel there was no name no address on card. Nike and Evri again didn't know what's going on or where the parcel has gone or how somebody could pick it up with out being me. Nike is the worst company I have ever dealt with customer service is really poor no help not a clue how to deal with situation on top very rude asked 5 times for someone to contact me no response every time all I got told where lies about call back from a manager today every time which never happened till this day Evri and Nike as bad as each other both clueless of what was going on or happened it has been over a month never heard anything from Nike still Never buying Nike again for me or my kids,June 27 2023,27/6/2023,Helpful (3),3,Trainers,,1,1,1,0,0,3
Ramon t.,Virginia 1 review 0 helpful votes,Virginia,$#*! Nike!,"I set up an after pay and they took the whole balance, I called they never fixed and it made me short on my rent, so I ended up paying a $200 late fee for Nike mistake, never again",August 6 2022,6/8/2022,Helpful (0),0,Shoes ,don't do it,1,1,1,1,1,1
Christine W.,Washington 1 review 0 helpful votes,Washington,JOHON AT NIKE,I had an issue with my order and spoke with Johon at Nike. He was not of any help and would not give me the name of his supervisor... Very unprofessional customer service.,December 23 2022,23/12/2022,Helpful (0),0,Shoes,Customer service sucks!,1,1,3,3,1,3
John C.,New Zealand 1 review 1 helpful vote,New Zealand,Not ideal,,May 29 2017,29/5/2017,Helpful (1),1,,,1,0,0,0,0,0
Vinh Y.,Canada 1 review 0 helpful votes,Canada,DO NOT ORDER FROM NIKE.COM,"Order 1 pair of shoes and set of socks on Oct 20. Told the delivery window was Oct 23-29. Oct 30 nothing came. Order says still being processed.  Called them Oct 30. They said they didn't know where the order was. I said to cancel. They said OK and would give me a refund in 5 days.  Get email 2 days later saying the order was split into 2 shipments. 1 package they can track. The other they don't know where it is. They don't know which has the shoes and which has the socks. They think 1 package will still be delivered. Don't know when. They won't give me a refund until they get their products back. What the?! I don't know where your packages are. Why should I wait until your packages are found before I get a refund?  NO order status updates NO accountability. Said I would get a refund and say something else later. NO customer service. Seperate \escalation team\"" that deals with refunds. CSR is totally useless.  Your customer should not have to deal with your lost packages before getting a refund.""",November 2 2018,2/11/2018,Helpful (0),0,,,1,0,0,0,0,0
Erin K.,Canada 1 review 0 helpful votes,Canada,Poor quality and customer service,"I bought Nike air max for my 10 year old son. After only 10 days of wear the sides got 2 holes in them. After a month the whole side was almost blown out. I contacted Nike Canada And sent pictures of the shoes and was told by representative it is definitely a manufacturing issue, I asked if I needed to send them in and he said no a warranty pair would be sent in the mail and I would receive in six weeks. After six weeks of not hearing anything I contacted like again only to be told that I must pay to send them back to be assessed warranty. Meanwhile I was waiting six weeks for shoes I was told for coming and my son was wearing sneakers full of holes while I waited. I then spent $40 to send the sneakers back only to hear from Nick today that they are not warranty in the sneakers because it is not manufacturing it's the use of the sneaker. My son wore them for less than a month with the sides blowing out of them. It's ridiculous that they would not be warranted and cannot stand a few weeks on a 10-year-old foot extremely disappointing and frustrating and poor customer service and quality from Nike.",October 8 2022,8/10/2022,Helpful (0),0,Sneakers,,1,0,0,0,0,0
Jason A.,Nigeria 1 review 0 helpful votes,Nigeria,Nike Sneakers are simply top notch,,January 14 2023,14/1/2023,Helpful (0),0,,,5,0,0,0,0,0
Vanessa C.,Florida 1 review 1 helpful vote,Florida,Wrong size,"Shop with you online is a nightmare, always send the wrong size of shoes.this is ridiculous and unbelievable",January 25 2024,25/1/2024,Helpful (1),1,,,1,0,0,0,0,0
Wilbur B.,Virginia 5 reviews 3 helpful votes,Virginia,Good experience,,June 9 2020,9/6/2020,Helpful (1),1,,,4,0,0,0,0,0
Janet T.,New York 106 reviews 432 helpful votes,New York 1,Wouldn't Order Again. Return Shipping is a Bit Misleading,"I wouldn't order again unless I REALLY want something. I'm neutral about this situation because Nike didn't really do anything wrong and their website and process was very easy to handle which is why I gave them 5-star because I didn't want to be biased. However, read the returns instructions carefully. I was under the impression that Nike has a free shipping (minimum order) and free returns policy.  I took a risk (first order on Nike) and bought this $220 jacket that categorized itself as loose fit, so I went with their smallest size on the chart which was XS. I'm normally a size S in everything USA. When this XS jacket turned out too big still, I thought \no problem I'll just return\"". I went through the process and it turns out the return label for guests is just a mailer label. It's not a pre-paid return label which is for members only. I made an account after to see if I could get the pre-paid label but of course it didn't recognize my order even though the account and order was made from the same email.  Now I have to commute 1 hour to a Nike store to return because this jacket is so large and heavy shipping it back would cost at least $30 and I'm responsible for it if it's lost in transit. Unless you want to make an account just for that ONE item at Nike I would say don't bother unless you're ok with paying for returns. God knows what UPS or the post office will charge you.""",December 7 2020,7/12/2020,Helpful (0),0,,,5,0,0,0,0,0
Ava-J W.,Canada 3 reviews 0 helpful votes,Canada,Swoosh,I love Nike Air max 90s so of course I'm going to do this review becausei love to buy new shoes on a regular and customized shoes even more so Nike I love you guys only thing you need to up your game is making it so even when bought online we can do a return in stores,January 31 2022,31/1/2022,Helpful (0),0,Shoes I've ordered clothing sandals,,5,0,4,3,2,5
LIsa J.,Texas 1 review 14 helpful votes,Texas,Zero for Customer Satisfaction,Ordered a pair of Nike Air Force 1's showed available and paid for next day delivery. The next day I got a tracking number for the Fed Ex delivery. After waiting half the day with no delivery I called Fed Ex. Fed Ex states the tracking number was not valid and was not in their system. Fed Ex advised me to contact the sender. Called Nike was told that although the email said shipped the tracking number was no good and they did not have the shoes in stock. A refund after Christmas and a discount to make an online purchase is what I was told was available. He went on to say I was one of many customers calling with the same complaint. I ask for a supervisor but was told he was on another line handling another complaint. He then offered the number to the corporate office which would not open until Monday morning. Worst customer service ever. Nike has my money and I have no merchandise. Money is withdrawn immediately from my account but I have to wait 2-5 days for a refund. Nike was my go to brand but time to move on.,December 22 2019,22/12/2019,Helpful (14),14,,,1,0,0,0,0,0
Aharon A.,Israel 1 review 2 helpful votes,Israel,Great Jordan Max,,June 12 2020,12/6/2020,Helpful (2),2,,,5,0,0,0,0,0
Victor k.,Kenya 1 review 0 helpful votes,Kenya,IS NIKE.COM A FAKE SITE,"No, Nike.com is the official website of the well-known sports brand Nike. It's the legitimate online platform where customers can purchase Nike products directly from the company. However, it's important to be cautious online, as there might be fraudulent websites that mimic the appearance of legitimate sites like Nike.com in an attempt to deceive customers.  To ensure you're on the authentic Nike website, here are a few tips:  Check the URL: Make sure the web address is correct. The official Nike website is www.nike.com.  Look for Security Features: Legitimate websites often have security features like HTTPS in the URL and a padlock symbol in the address bar, indicating a secure connection.  Check Contact Information: Authentic websites usually have clear contact information, including a physical address, customer service phone number, and email address.  Research the Site: Look for reviews or information about the website online. If it's a scam or a fake site, there might be warnings or negative reviews from other users.  Be Wary of Deals Too Good to Be True: If the prices seem unbelievably low or if the website is offering extreme discounts that seem too good to be true, it might be a red flag for a fake site.  If you're uncertain about a website claiming to be Nike or have any suspicions about its authenticity, it's best to refrain from making any purchases and, instead, directly visit the official Nike website or use authorized retailers to ensure a secure shopping experience.",December 10 2023,10/12/2023,Helpful (0),0,,,5,0,0,0,0,0
Cara S.,New Jersey 16 reviews 55 helpful votes,New Jersey ,This site has awesome athletic wear and shoes,,May 9 2013,9/5/2013,Helpful (2),2,,,5,0,0,0,0,0
Lana B.,8 reviews 1 helpful vote,#VALUE!,Satisfied customer!,,November 22 2018,22/11/2018,Helpful (0),0,,,4,0,0,0,0,0
ÐÐ»ÐµÐºÑÐµÐ¹ Ð¢.,RU 1 review 3 helpful votes,RU,Great running shoes,"Excellent running shoes, I always take only this company. I like the ease of running and the high durability of Nike. Puma are also good, but I am loyal to Nike.",June 20 2023,20/6/2023,Helpful (3),3,,,5,5,4,5,5,5
Charles S.,Canada 1 review 7 helpful votes,Canada,No Black Friday sales for Canadians,No Black Friday sales for Canada. Canadians lives matter. I talked to customer support and they said they have no idea why Canada is not on the list for Black Friday sales.,November 24 2023,24/11/2023,Helpful (0),0,,,1,1,1,1,1,1
Tomas F.,Finland 4 reviews 1 helpful vote,Finland,I recommend,"I recommend, I constantly buy and upgrade at nike, I am satisfied with the quality Beautiful store with fair prices. The staff is always friendly and attentive.",June 1 2022,1/6/2022,Helpful (0),0,,,4,0,0,0,0,0
Mariz K.,Netherlands 1 review 0 helpful votes,Netherlands,Bad refund services,,August 15 2019,15/8/2019,Helpful (0),0,,,1,0,0,0,0,0
Mike D.,Ohio 1 review 1 helpful vote,Ohio,MY BROTHER DIED FOR THIS COUNTRY,,September 5 2018,5/9/2018,Helpful (1),1,,,1,0,0,0,0,0
Julie S.,Michigan 1 review 0 helpful votes,Michigan,If Nike is an American multinational corporationâ€¦,"If Nike is an American multinational corporation that is engaged in the design, development, manufacturing, and worldwide marketing and sales of footwear, then why are there literally four pairs of shoes that are sold in mens wide? It's frustrating and disappointing that this multi-billion dollar company doesn't understand that everyone's foot is not a M. My options are black mesh with a white swoosh, or black mesh with a black swoosh. My conversation with customer support was a waste of time. For my frustration, they gave me 10% off. I literally just told them I cannot find shoes, but here's 10% off, SMH. I am beyond frustrated with Nike. Corporation that is engaged in the design, development, manufacturing, and worldwide marketing and sales of footwear, then why are there literally four pairs of shoes that are sold in mens wide? It's frustrating and disappointing that this multi-billion dollar company doesn't understand that everyone's foot is not a M. My options are black mesh with a white swoosh, or black mesh with a black swoosh. My conversation with customer support was a waste of time. For my frustration, they gave me 10% off. I literally just told them I cannot find shoes, but here's 10% off, SMH. I am beyond frustrated with Nike.",April 17 2022,17/4/2022,Helpful (0),0,,,1,0,0,0,0,0
Kerry C.,Ukraine 2 reviews 0 helpful votes,Ukraine,Good for its money,I loved that brand for a long time. I had a lot of clothes and trainers of this brand. Now I buy different sport brand clothes. What I can say is the trainers are good of this brand.,May 23 2021,23/5/2021,Helpful (0),0,,,5,0,0,0,0,0
Natalija S.,Canada 1 review 0 helpful votes,Canada,Unsatisfactory order experience,"I ordered a pair of shoes with Nike.com and the experience has been really 'meh'.  1. The order tracking was unreliable: information on the order page was not updated, the email notification \order shipped\"" was sent after the order was delivered and I did not receive \""delivered order\"" notification in time to ensure I could pick up the package so it wouldn't be stolen. 2. The support team was not able to provide more details on the order than the non-fuctional order page; I would not blame this on a support specialist as I think they might not have the needed information. However overall it was a disappointing experience. 3. Support chat is bugged: I was in the middle of the chat with a customer support specialist; they told me something like \""please wait a minute I'll get back to you\"" and the chat was closed due to me being inactive. 4. Shipping is very slow - I was expected much speedier delivery from Nike; in the future I'd prefer to order from a reseller instead or choose another brand.""",November 22 2022,22/11/2022,Helpful (0),0,,,2,0,0,0,0,0
John D.,GB 1 review 0 helpful votes,GB,Best,"One of my favorite brands. It's always comfort and stylish. A few weeks ago I bought 2 pairs of sneakers Air Jordan 1 Hi FlyEase and Nike Metcon 7. Both pairs a great, I'm happy.",December 2 2021,2/12/2021,Helpful (0),0,,,5,5,5,5,5,5
Melodee M.,Oregon 1 review 0 helpful votes,Oregon,Kappernick ad,,September 4 2018,4/9/2018,Helpful (0),0,,,1,0,0,0,0,0
,California 1 review 0 helpful votes,California,Annoyed,"One of my pet peeves is when you order something online to make your life easier and you end up on the phone with them on and off for 2-3 weeks holding everybody's hand and trying to get them to do their job correctly. I ordered a pair of shoes from Nike. I got the item I ordered, but with someone else's receipt in the box. I had to call customer service to get my correct receipt and shipping label e-mailed to me so that I could return the shoes. The shipping label with the incorrect information they already sent me was pre-paid. The correct one they sent me was not, so I ended up paying $17 to ship the shoes back to Nike. They did not send me a confirmation that they received them or that a return was being processed, so I had to call them again. I asked if I could be reimbursed because I had to pay to return the shoes because of a mistake they had made. They said they would give me a discount on the next pair of shoes I ordered...even though I am obviously not eager to repeat this experience. It's not so much the amount of money, it's the principle. They made a mistake, then made ANOTHER mistake on top of it, and because I didn't have time to make yet another phone call to them asking them to send me the correct label, I had to pay for it and they are not willing to meet me halfway.",January 27 2019,27/1/2019,Helpful (0),0,,,2,0,0,0,0,0
Susan H.,Georgia 1 review 0 helpful votes,Georgia,I am only giving them a one star because there isn't a way to give them zero stars.,"HORRIBLE HORRIBLE HORRIBLE CUSTOMER SERVICE. Literally tried for 12 hours to order an egift card for my son's birthday. Tried THREE TIMES to order online, with no success. Called there and spoke with FOUR DIFFERENT PEOPLE who STILL could not figure out how to place an order for me! Unbelieveable that this company is still in business.",July 24 2023,24/7/2023,Helpful (0),0,,,1,1,0,1,0,0
Deger O.,Netherlands 1 review 1 helpful vote,Netherlands,Don't buy gift cards from Nike.Com!,"I received a gift card as a birthday gift. I didn't use it for couple of months since the website says it doesn't expire. When I tried to use it in a nike store (after picking items I wanted to buy), the cashier told me that I could only use it online. When I went to the online store, the card gave an error.  I called customer services and after waiting for many minutes to speak to someone, and for that someone to speak to someone else... she told me that the card had expired, but that \I shouldn't worry\"" because they would issue me a new one... which would take 3 - 5 days and she would call me to give me the new card number...  The story is clear and honest. The issue may seem to have been solved. BUT imagine buying a 'gift' for someone and him/her having to go through such a hassle to be able to use that gift?! This is not customer-centred service it is organization-centred service! This was even clearer when the lady said she could only call me (and not email me) because she is a phone-agent. Apparently phone agents and email agents are different people sitting in different departments and the organisational system does not allow them to communicate with each other. Unbelievable! Awful awful experience. I am never stepping into a nike store again.""",October 11 2019,11/10/2019,Helpful (1),1,,,1,0,0,0,0,0
Aniece F.,Washington 37 reviews 196 helpful votes,Washington ,"Obviously, they're legit because its Nike","Obviously, they're legit because its Nike. Like, that's a huge company. But just because they're legit doesn't mean they're the greatest place to order from. Recently, I ordered a pair of shoes from here and I ordered them at like 6 A. M on August 1st. By noon they sent me an email telling me that my order has been shipped. I was in awe. Like, WHAT? It's only been a few hours! But yep, about a day later I received an email from UPS (I'm enrolled in UPS My Choice, its a great program if UPS ever delivers to your house and if someone is trying to surprise you with a gift and it gets sent to your house. You'll get the email) the email was telling me that my package will arrive on Monday the 5th between 2:45pm and 6:45 pm. Super specific.  I'm thinking, wow this is the best order I've ever gotten. And lo and behold on Monday the 5th at 2:52 pm my package arrived. And it was in a big box and in that box was another box with the shoes in them. I liked it better because no one could tell I had ordered shoes. Oh Nike, you've won my heart. If I ever need Nikes again I'm ordering them rather than going in the store to get them.",August 8 2013,8/8/2013,Helpful (3),3,,,5,0,0,0,0,0
Female A.,Canada 1 review 0 helpful votes,Canada,Female athletes being disrespected,Dylan mulvaney is mocking female athletes and taking the 1% spot light from hard working talented female athletes who give their blood sweat and tears for the sport.,April 10 2023,10/4/2023,Helpful (0),0,,,1,0,0,0,0,0
Jason D.,Honduras 3 reviews 1 helpful vote,Honduras,I use nike since I have like 3 years old.,"I love the nike shoes, not so much the running apparel because adidas has better looking, but when we talk about the runinng shoes... Nike is the best! For me :)",August 4 2023,4/8/2023,Helpful (0),0,Nike running shoes,No,5,0,5,4,0,5
YAROSLAV K.,New York 1 review 0 helpful votes,New York,Thank you for submitting your report to the Federal Trade Commission.,,October 16 2020,16/10/2020,Helpful (0),0,,,1,0,0,0,0,0
Jill M.,California 1 review 0 helpful votes,California,Cost me $30 to return my shoes!,I had to pay shipping of $20 to return shoes. Then they only refunded me 80 of the 90 dollars the shoe cost. $30 to return a pair of shoes is rediculous! I will NEVER order anything Nike again.,February 25 2022,25/2/2022,Helpful (0),0,None. I will never use ANY Nike product again.,Nike charges approx $30 to return shoes. Don't order Nike.,1,1,1,1,1,1
Amanda A.,Wisconsin 1 review 0 helpful votes,Wisconsin,Shoes Mysteriously Disappeared,"I ordered three items when Nike was offering the sitewide discount. Two sweatshirts arrived separately within a couple weeks. The AF1s I ordered for my daughter said they shipped around the same time and a FedEx tracking number was provided. It seemed like shipping was taking a really long time so I checked the tracking and FedEx never received the package. I decided to contact customer service because two weeks had passed since the tracking number was issued. After more than 30 minutes in chat with \Jom\"" whose communication was a mix of auto response and really bad English I was informed that \""FedEx lost the package\"" (funny since they never received it) and did I want a reship or refund. I requested reship and was then told the shoe was out of stock and my only option was a refund. I expressed that my daughter was going to be really disappointed and was told I should shop for the shoes elsewhere!?#@! I asked if the shoes were \""found\"" if they would still be shipped and was told my only option was a refund. I asked for details/documentation of the refund. Chat has timed out twice now and despite being told I would get documentation \""Jom\"" has not provided it. I guess this is the last time I'll be shopping Nike - what a joke and total waste of time. It's now been an hour in the online chat and my issue is yet to be resolved.""",November 20 2022,20/11/2022,Helpful (0),0,,Assume customer service will be completely unhelpful if any issues arise.,1,1,3,1,0,0
harmoney s.,Indiana 1 review 0 helpful votes,Indiana,I LOVE IT,I love Nike it is the best shoe brand I can take my runs and my feet won't hurt this helps my mom get up and ready for her day and me it is stylish with their dunks me and my entire family love it.,September 6 2023,6/9/2023,Helpful (0),0,,,5,0,0,0,0,0
Island G.,Pennsylvania 1 review 1 helpful vote,Pennsylvania,Refurbished shoes. Return address is VIETNAM,"NIKE SHOES ONLINE STORE is a scam. DO NOT buy these cheap, used, refurbished Nike shoes. Bought Air Jordan's from Nike Shoes Online Store. Took weeks to get my shoes. Look used. The return address on package is Sacramento, California. However, the actual RETURN address is VIETNAM. Costs about as much as the shoes to return to Vietnam. SCAM. This is the customer service email of the site: *******@cservicesteam.com.",September 5 2023,5/9/2023,Helpful (1),1,,,1,0,0,0,0,0
Ciara M.,Georgia 1 review 3 helpful votes,Georgia,Will never buy again,"Worth the read, but quite long, but unfortunately that's the experience I've had in the past 48 hours. I would choose 0 stars but that's not an option.  -I've spent over 2 hours collectively on hold during the busy holiday. -I've been sent to a store that \had the shoes on hold for me by a manager named Lincoln.\"" Glad I called the store although I was already halfway there didn't even have the shoes in stock and no manager named Lincoln. Unfortunate the Nike employees weren't even capable of calling a store and directing me there. -I originally ordered these shoes on black Friday looked to exchange them for a different size... got an email after the exchange that they didn't even have the size I wanted in stock and they had refunded me my money. Would have been nice to know they were out of stock when I spoke to customer service the 1st time that they didn't have what I wanted. -And after all of this all they want to offer me is 20% my purchase? That wouldn't even cover the gas I spent going to the wrong location during Christmas traffic.  I have never written a poor review for any company in my life knowing that it wasn't worth it but believe me when I say I will NEVER shop from Nike again with the way they have treated me with inconsistency and incompetence.""",December 22 2017,22/12/2017,Helpful (3),3,,,1,0,0,0,0,0
Mark O.,Illinois 2 reviews 0 helpful votes,Illinois,Good store and fast shipping,,November 25 2020,25/11/2020,Helpful (0),0,,,5,0,0,0,0,0
Yusef O.,Tennessee 1 review 4 helpful votes,Tennessee,LAKEISHA WARE DOES VOODOO SHE IS A WITCH,I know a female name LAKEISHA WARE IN Memphis who says she charges 60$ to get in Nike an brags on doing Hindu voodoo! She has missing teeth an is very $#*! type! She brags on selling y'all shoes to men in Memphis under price too an she also smokes weed an on percs,January 3 2024,3/1/2024,Helpful (4),4,None im reporting a worker,,1,1,1,1,1,1
Alex F.,GB 3 reviews 7 helpful votes,GB,My favorite,,September 8 2021,8/9/2021,Helpful (0),0,,,5,0,0,0,0,0
