name,location,location_updated,review_title,review_content,date,date_updated,helpful_vote,vote_count,products_used,consumer_tips,overall_rating,service_rating,value_rating,shipping_rating,returns_rating,quality_rating
Laurie B.,Massachusetts 1 review 2 helpful votes,Massachusetts,Faulty sneakers!,I recieved a pair of sneakers for Christmas. I picked them out online and sent my son the link. I wore these sneakers all of 4 times! The zipper broke! When tried to return them I got alit run around. But the final result was. I got no sneakers. I had to take the time to return them. And since they didn't have my sneakers in stock. I got nothing! Merry Christmas to me. Never again. Lesson learned!,March 7 2022,7/3/2022,Helpful (2),2,Sneakers,Buyer beware. Sneakers lasted 4 days! And I just used them fir walking!,1,1,1,1,1,1
Eri C.,Georgia 1 review 0 helpful votes,Georgia,Won't let me get in line for some shoes,I've been up all morning waiting for these shoes to drop and it kept glitching me off when it came to putting in my phone number now I have to wait 24hrs to get inline which they are going to be sold out again!,October 27 2023,27/10/2023,Helpful (0),0,,,1,1,5,0,0,0
Ernie B.,Indiana 1 review 0 helpful votes,Indiana,Squeaky shoes,,April 29 2022,29/4/2022,Helpful (0),0,,,1,1,1,1,1,1
Jenna P.,Maryland 2 reviews 1 helpful vote,Maryland,"No Product, No Help, No refund","I bought 3 items from Nike.com I got an order confirmation, for all 3 items. I paid extra for 2 day shipping since it was for a gift. I received 2 of the items and the third is still missing with no tracking information. I contacted Nike on Friday asking them to give me an update since I needed the product before Saturday and was told twice a Nike Elite member would contact me directly. I still have no item, I have had not contact with Nike and when I contacted Nike again, I was told a Nike Elite member would contact me. I have no leggings, no help finding them, no response from any NIke Elite Team Member, and no refund. I would give them 0 stars if that would have been an option",January 30 2018,30/1/2018,Helpful (1),1,,,1,1,1,1,1,1
katherine s.,Pakistan 4 reviews 2 helpful votes,Pakistan,Top 10 discount coupons from dig my cart,"There isn't a better method to end your misery than to take advantage of the eid bargains, in my opinion, if you're someone who has recently needed athleisure badly but hasn't been able to do so due to the high end pricing. Thus, don't waste this opportunity and use the digmycart eid sale coupon and top 10 eid discount to get your favourite things.",September 3 2022,3/9/2022,Helpful (0),0,,,5,5,5,3,3,5
Lawanda C.,Georgia 1 review 1 helpful vote,Georgia,Worst customer service ever!,I ordered a pair of shoes on July 12th. They were supposed to arrive no later than July 26th. It is now July 29th and the shoes have not even shipped yet. I ordered them for a specific event and had to end up getting a different pair from another store. I have called Nike and chatted with customer service at least 10 times to try to cancel this order. They keep saying that they cannot cancel it and that I will have to wait until the shoes arrive and send them back for a refund. They refuse to put a supervisor on the phone. This has been the worst customer service ever. I will never shop with them again!,July 29 2021,29/7/2021,Helpful (1),1,,,1,0,0,0,0,0
Axel C.,Wisconsin 2 reviews 1 helpful vote,Wisconsin,Never a good experience when the first time you use the site and never get your order,"Place an order online. Was told it would arrive by 4.6.23. Got an email sometime after I placed the order that it was delayed. I contacted Nike.com. Was told I would still get it on time. Today, 4.5.23, contacted them again because there had been no updates. Was told that the order was automatically cancelled because for whatever the reason the shipment didn't got out. Never got an email to that effect or anything. If I hadn't contacted them, I would still be here waiting.",April 6 2023,6/4/2023,Helpful (0),0,,,1,1,1,1,1,1
YW T.,Georgia 1 review 0 helpful votes,Georgia,Nike website and customer service sucks.,"While trying to purchase a pair of Nikes for my grandchild the website blocked my purchase. For no known reason. I called customer service and they couldn't work around it. Please understand I am not a child, have an excellent credit rating with nothing to justify this. An hour and a half later I still could not purchase these shoes for my grandchild. I was told zi would receive an email connecting me to the ability to purchase and never did. My grand daughter is heartbroken and I will never purchase a pair ok Nikes again",January 3 2024,3/1/2024,Helpful (0),0,,,1,1,1,1,1,1
Ocean b.,New York 1 review 0 helpful votes,New York,Horrible experience I'm sure its the worst,"Well I thought I was waiting to tell everyone how the Nike vapormax flyknit utility was the best I've had as I tried them on at my sister's wedding saturday. However I'm here doing the exact opposite, letting the world know how horrible my experience with Nike.com was. I've tried ordering the shoes then they canceled my order with out notice, after doing so \Courtney\"" from Nike left an email saying its been canceled and a number and extension to reach her. I tried contacting Courtney twice no response. Then later on in the day just to realize my account at nike.com was blocked by administration/management. No one at nike.com can explain this. So now I'm having to find a new pair of shoes else where that can be comfortable for long standing at my sisters wedding. Horrible Nike Horrible""",September 7 2018,7/9/2018,Helpful (0),0,,,1,1,1,1,1,1
Rajaa H.,Canada 1 review 3 helpful votes,Canada,Terrible customer service,,April 14 2023,14/4/2023,Helpful (3),3,,,1,1,1,1,1,1
Jane R.,India 12 reviews 4 helpful votes,India ,Big Fan,,December 18 2020,18/12/2020,Helpful (0),0,,,5,1,1,1,1,1
Leuka C.,New Zealand 1 review 0 helpful votes,New Zealand,Do not buy from Nike - official website,"Purchase two pairs of shoes 5 months ago, took 1 month to arrive in Customs Auckland - since then there were no more updates. After requesting an investigation that took a further month I requested a refund. It has now been 5 months, many phone calls, no shoes, and NO REFUND, I am beyond frustrated. I've been advised that Nike has refunded me to a PayPal account in CAD dollars. Firstly I paid with my NZ credit card in NZD. I do not have a PayPal account and I have not received any refund in any of my accounts. We are now disputing this refunded - all over two pairs of shoes purchased 5 months ago costing me $238.94 NZD ouch! Do I cut my losses or keep fighting? Do not buy from this company",December 7 2022,7/12/2022,Helpful (0),0,,,1,1,1,1,1,1
Hale J.,Florida 1 review 0 helpful votes,Florida,Horrible Customer Service. LIES,"All the reviews your reading are absolutly correct. Ordered a large order and muitiple items did not come, they said items show delivered, well of course they show delivered but not all items where in the box or ever came seperate, Customer service played games for 3 weeks each one acting like they created a case because they knew nothing then you call back and next person plays dumb then claims to create new case over and over. Like other posters they hang up acting like it gets disconnected, i even told them show me the video of them putting the missing items in my box if you think iam lying, they of course said we believe you but never refunded, they play games to see if your going to keep pursuing the issue. They finally said just call your credit card company and dispute the charge which i did but that is absolutly unreal a company this big plays games like this and absolutly nobody cared to make it right other the just call your credit card to dispute",December 18 2021,18/12/2021,Helpful (0),0,,,1,0,0,0,0,0
Malgorzata W.,Poland 1 review 1 helpful vote,Poland,NIKE Returns is a real nightmare,"I ordered the Nike sweatshirt on October 12,2020. Cash on delivery. The sweatshirt turned out to be too small so I gave it back. Really, in the darkest visions, I did not foresee the nightmare connected with money refund... It is a torment... Do not count on a fast money refund as in the case of Zalando:-) Everything is soooo complicated, I think it is done on purpose! It's 16/11/2020 and I still haven't got my money back... I will not let it go. I will report the matter to the Consumer Ombudsman. Next I will report extorting to the Police. I advise other unhappy Nike customers to do the same! For NIKE, I suggest simplifying the RETURN process even further... Maybe for example allow to return the product only for marathon runners? Whoever survives running 42,195 km will survive the NIKE Return!",November 17 2020,17/11/2020,Helpful (1),1,,,1,1,1,1,1,1
Theresa F.,Ohio 1 review 1 helpful vote,Ohio,Horrible customer service,,October 22 2020,22/10/2020,Helpful (1),1,,,1,1,1,1,1,1
Jessica J.,GB 1 review 1 helpful vote,GB,Excellent,,February 28 2019,28/2/2019,Helpful (1),1,,,5,1,1,1,1,1
Jen J.,Norway 1 review 2 helpful votes,Norway,Nike cancelling my order,I bought a pair of shoes from Nike and recived a confirmation email that they confirmed my order. I was so excited about these shoes to arrive until days later I get a message that my order was cancelled. Because the shoes I bought was out of stock all of a sudden just out of nowhere and that their physical stock aren't in sync with what's displayed online. What's ridiculous is that the shoes I bought is still on their website even after this annoying mail entered my inbox. What I got in return is 10% lousy discount on my next order. I don't want no 10% discount I want the shoes I ordered still displayed on the damn website.,February 12 2021,12/2/2021,Helpful (2),2,,,1,1,1,1,1,1
Lynn C.,Colorado 1 review 2 helpful votes,Colorado,Nike is UNAMERICAN,,September 8 2018,8/9/2018,Helpful (2),2,,,1,1,1,1,1,1
Diane M.,New Jersey 1 review 1 helpful vote,New Jersey,Nike does not stand behind their product,"I bought a pair of Nike Mamba Rage for my son about 3 months ago. He told me there was a sharp piece of metal that was protruding through the interior heel of the shoe and it cut his heel. I inspected the shoe and not sure if it was metal or plastic, but it was poking through the fabric and he could not wear the sneakers. I called Nike and the advised that since I purchased them at $#*!'s Sporting Goods they would not warranty their defective sneakers. They said it would need to be purchased from one of their \honor\"" stores. If they sell your product then you should stand behind it. IDK what an \""honor\"" store is but as you see from their reviews Nike is not honorable! $#*!'s store exchanged the sneakers without an issue. You lost a customer Nike!""",December 6 2018,6/12/2018,Helpful (1),1,,,1,1,1,1,1,1
Lori S.,Michigan 1 review 0 helpful votes,Michigan,Extremely disappointed!,"I bought my son a pair of Nike Vapormax shoes, cost $160 back in May, within 3 months the sole had come apart from the shoe in one spot so I sent the shoes in to Nike to have them replaced, well today I received an email stating because the tag was not there they couldn't offer a refund or replacement because that tag tells them when they were manufactured, they will NOT give me a credit or replacement. Those tags tend to fade sometimes with the wearing of the shoes, but they don't seem to understand that, I even offered a copy of my receipt and that didn't matter to them. My family has bought a ton of Nike products for many years, I always thought they would stand by their products but I was wrong. Be careful what you buy from them and how much you spend as they may not stand by the sometimes poor quality of their products. I will be looking for another brand of shoes and clothing products for my family.",October 29 2019,29/10/2019,Helpful (0),0,,,1,1,1,1,1,1
Renee G.,Washington 1 review 0 helpful votes,Washington,Stains,,April 2 2023,2/4/2023,Helpful (0),0,,,1,1,1,1,1,1
Jamarion B.,Tennessee 1 review 0 helpful votes,Tennessee,Jamarion D. Boyland,,April 29 2022,29/4/2022,Helpful (0),0,,,1,1,1,1,1,1
Elizabeth M.,Georgia 1 review 0 helpful votes,Georgia,Cleats on on a slow boat form Vietnam,,September 5 2018,5/9/2018,Helpful (0),0,,,2,1,1,1,1,1
Jarrik O.,Netherlands 1 review 21 helpful votes,Netherlands,Scammers,"Y'all are the worst company on damn earth, got hacked and the payment wasn't arrived and they couldn't stop it. Probably because they are just a horrible capitalist company that don't give a hoot about how they get money. Literally scamming people and using child labor. All you had to do is stop the transaction or atleast give me like a voucher anything. But no, they just kept blaming every other thing. Horrible capitalistic dogs.",May 7 2020,7/5/2020,Helpful (21),21,,,1,1,1,1,1,1
Sami S.,Washington 1 review 0 helpful votes,Washington,Canceled ny order without any justification,"I placed an order of $400, later they cancelled my shipment, charged my card twice and claimed that the transaction didn't get through because my information was inaccurate. I called them and they claimed that the shipment address is not matching my Credit Card address, but they charged me twice. I put the charges under dispute because they didn't refund my Credit Card. You know what they say Â´They say full me once shame on you and full me twice shame on me\. I placed second order a month ago of $ 450 and again the same issue they charged my credit card twice Deja Vue shame on me. I went through the same process again and get my money back. I am planning to report them to the business bureau because they shouldn't be doing business. Imagine how many orders they received in a week deposit the money in the bank and get interest. You do the math.""",December 28 2022,28/12/2022,Helpful (0),0,,,1,1,1,1,1,1
Jozef L.,Germany 1 review 3 helpful votes,Germany,I never again buy Nike products,My order EO******* has been canceled after five day's they explain that they have a bug on online store with wrong price. They gave me a coupon for 15% discount (haha). I have to wait for a refund another week or two. This company is very unprofessional.  It took them five days to figure out something was wrong and they canceld my order. After that they have proposed me a discount that is worse than the standard promotions that they set for everyone.  I never again buy Nike products on their online store or anywhere else. Luckily there are similar or better products from other companies at even better prices and certainly with normal service.,July 26 2017,26/7/2017,Helpful (3),3,,,1,1,1,1,1,1
Chris b.,California 2 reviews 2 helpful votes,California,Your Disrespectful to our country and Flag,,September 6 2018,6/9/2018,Helpful (1),1,,,3,1,1,1,1,1
Slobodan S.,Canada 1 review 0 helpful votes,Canada,Very unprofessional,"VERY BAD EXPERIENCE. I returned the shoes that broke after one month of use and I am waiting for my gift card for over 6 months. They approved the claim and \sent\"" the gift card but I never got it they said that they sent it twice but it never arrived and I have called the customer service but they do not care about their customers and they keep giving lame excuses as to what's happening. They are saying that they do not know anything about what is happening with the card and they keep \""escalating\"" the case but nothing is happening. By far the worst experience I have had with their service. They do not even say when the shoes are made but they keep selling old shoes that are sitting in store for god knows how long""",October 7 2022,7/10/2022,Helpful (0),0,Sneakers,Do not use!!!,1,1,1,1,1,1
Tati A.,Canada 1 review 1 helpful vote,Canada,Buy NIKE online,"I posted a review about my unsuccessful experience with NIKE on July 23,2023. I had a bad shopping experience at the Nike Fairview Mall in Toronto. I bought Nike sneakers and the day after the defect was discovered, I asked to exchange them at the store, which the store manager refused to do. After writing my review, Nike representatives contacted me and offered me a Nike card worth twice the amount of my purchase. I was pleasantly surprised because the card was actually sent to me and I was able to use it. I thank Nike for cherishing their name and appreciating their customers. However, now I will only buy Nike products through the website, but not in the store that I indicated, because the stores have their own policies, and in case of defective products they may refuse to exchange the goods.",July 25 2023,25/7/2023,Helpful (1),1,Shoes,Buy NIKE online,5,0,0,0,0,0
King K.,South Africa 1 review 0 helpful votes,South Africa,They'll sell you shoes that are not even in stock..,"I made an order on the 28th of September, they promised to deliver the shoes between the 3rd and 12th of October. I kept tracking the order and it was stuck on \Processing Shipment\"" for weeks. Finally on the 12th I realised this order is never going to change status then I called them and I was told that they made a mistake by selling me a shoe that is out of stock and I should now wait for a refund that will only appear in my bank account after 10 working days (meaning I will only get it after the 22nd). Mind you the shoes were supposed to be a birthday gift for my wife who is born on the 12th. If I had never followed up they were never going to call me. I strongly discourage anyone looking to buy from them!""",October 12 2022,12/10/2022,Helpful (0),0,,,1,1,0,1,0,0
bill b.,New Jersey 1 review 0 helpful votes,New Jersey,Customer service sucks,I ordered 1800$ worth of shoes and I received one empty box and one box that had a pair of women vapor max in purple in a box that was for my all white with green swoosh in a size 10. Coustomer service is overseas and can not Understand English and I never received anything so I lost out on over 400$in shoes. FU Nike,July 4 2022,4/7/2022,Helpful (0),0,Addis,Call customer service first and get a feeling of what you will be going through.,1,1,1,1,1,1
Shannon B.,India 11 reviews 4 helpful votes,India ,"\Big Fan of Nike Sneakers\""""","I am a big Nike fan. I like Nike sneakers very much, I like their quality and the variety of what they are offering. Let me tell you a few weeks ago I bought Nike Sneakers i. E. Nike Court Vision Low and they were so cute and classy but mistakenly I got a big size but I contacted them for the exchange and within seven days they gave me the perfect size I needed. If you're a sneaker lover then you'd recommend buying Nike sneakers and just buying them from Nike's online store or offline Nike Store instead of buying them from third-party websites.",August 23 2020,23/8/2020,Helpful (2),2,,,5,1,1,1,1,1
Richard F.,China 1 review 12 helpful votes,China,Nike does not stand behind the quality of their products,"Nike does not stand behind the quality of their products and after being a customer for 25 years, I will never ever buy another Nike product again because of it.  I had a pair of nike running shoes tear apart after 4 months of use. I contacted the Nike store where i purchased them and all they could say was they had a 90 day return policy and they could do nothing about the bad quality shoes that tore apart.  I contacted enough Nike people until I was speaking with the Senior Customer Management rep and after 3 phone calls their best solution was to say they stand behind their 90 day policy instead of standing behind delivering a high quality product. In the best case scenario I hoped Nike would offer to exchange the shoes for a pair that were not torn apart, but they didn't think that was a reasonable request.  Nike did not even think to offer even a 50%, 10%, or even 1% discount on a new pair of shoes. They didn't offer to take them back and repair them. Their best suggestion was to go buy a new pair of shoes and hope the next pair don't rip apart.  I am absolutely appalled at this level of service from such a reputable company. I have sold my existing stock holdings I had with Nike, and I will never purchase a single Nike item for myself or as a gift again.",November 29 2019,29/11/2019,Helpful (12),12,,,1,1,1,1,1,1
Geo L.,Canada 1 review 0 helpful votes,Canada,They charge for shipping and delay refunding taxes,Ordered pair of shoes and returned as it was unsatisfactory. Nike didn't refund shipping costs and withheld refunding taxes I paid. When I called they said the taxes will be refunded at a later date,January 24 2024,24/1/2024,Helpful (0),0,,,1,0,0,0,0,0
Gina E.,New York 1 review 0 helpful votes,New York,Disgusted!,"Although I love the latest pair of sneakers I purchased, I will no longer purchase any Nike product and destroy what I currently have because of your support for Colin Kaepernick! As a parent with a child fighting for our country presently, we stand to support our past, present, and future military. To disrespect the ones that give their lives to support our country is NOT acceptable! I will also speak with everyone I see wearing your products and tell them the Nike symbol now is disrespect to me as I feel I can not support my daughter when your company thinks it's ok to not stand for her.",September 5 2018,5/9/2018,Helpful (0),0,,,1,1,1,1,1,1
Jack R.,Isle of Man 1 review 0 helpful votes,Isle of Man,Excellent sports shoes,"I bought sports boots for running. They are very convenient. I was a little bit afraid that the size would not fit, but everything was ok. Will definitely make some more purchases here.",February 12 2021,12/2/2021,Helpful (0),0,sports boots,Try it because the products are really quality.,5,5,5,5,5,5
Mark S.,Kansas 1 review 1 helpful vote,Kansas,Worst Company Ever,"Tried to order twice from these A...ssshats. Both times, they did not ship the shoes and worst, the customer service folks can't say why? Never again.",February 17 2023,17/2/2023,Helpful (1),1,,,1,1,1,1,1,1
DOMINIC M.,New Zealand 1 review 0 helpful votes,New Zealand,Online order Direct from Netherlands to New Zealand arrived in timeframe promised,"The Brooklyn 11 hoodie and black Airforce 1s bought off Nike Store for my 15-year-old boy have just arrived. He is still at school, so ofc I try on the hoodie. I decided I want it. But I can't have it because it's his. I'm going to order another one right now. But let me explain:  The Brooklyn hoodie has a very distinctive cut around the neckline, proof this ain't no rip-off or run-of-the-mill hoodie. It extenuates the shoulders and neckline, not baggy around the waist, fitted. Kanye West would definitely approve! It is dope. Oh, and it arrived in 14 days and would have arrived sooner if it hadnt got delayed in NZ customs for a week! Impressive speed considering NL and NZ are opposite ends of the earth. Other commentators are complaining about delays. Not my experience. Infact, faster than expected. Nice work NL Nike!",October 2 2022,2/10/2022,Helpful (0),0,Hoodie and sneakers,Nike Store is a reputable dependable and cutting-edge online retailer.,5,0,0,0,0,0
ARUP P.,India 1 review 1 helpful vote,India,Sole is damaged within 4 months of purchasing,"I am writing to express my disappointment with the quality of the [Airforce 1- Invoice No- ******* & Complain no *******] that I purchased from at Phoenix' Mall Mumbai, Within just four months of purchasing these shoes, the sole has become significantly damaged, which is unacceptable for a product of this caliber. After submission all the details and shoes picture in help line, I got replied after 2 days that \we regret to inform you that the claim did not meet our claim eligibility guidelines\"" I kindly request that i need desired resolution whether it's a replacement refund. This experience has left me dissatisfied and concerned about the durability and quality of your footwear. I believe it is low quality sole or manufacturing defects. But your company is giving excuses to me to avoid the replacement. See how it is damaged within four months of purchasing? The nike brand and I have always held your products in high regard. However this experience has left me dissatisfied and concerned about the durability and quality of your footwear. I believe it is low quality sole or manufacturing defects. But your company is giving excuses to me to avoid the replace or refund""",January 1 2024,1/1/2024,Helpful (1),1,Shoes,"See how it is damaged within four months of purchasing? the nike brand and I have always held your products in high regard. However, this experience has left me dissatisfied and concerned about the durability and quality of your footwear. I believe it is low quality sole or manufacturing defects. But your company is giving excuses to me to avoid the replace or refund",1,1,1,3,1,1
Logan M.,Kenya 1 review 0 helpful votes,Kenya,AMAZING!,I made an order and was delivered within two days. They reply to the emails instantly. Great customer and support service. Their products are affordable. It is the best!,July 10 2021,10/7/2021,Helpful (0),0,,You will love it!,5,5,5,5,5,5
Jack E.,GB 2 reviews 12 helpful votes,GB,Good online shop,,June 24 2018,24/6/2018,Helpful (12),12,,,4,1,1,1,1,1
Cindy B.,Florida 1 review 1 helpful vote,Florida,Customer Service doesn't care,"Ordered multiple items and 1 item didn't come, opened up a ticket and the response I got was we aren't going to give you curtesy because you have multiple accounts, i kid you not, so my family can't have accounts linked to a computer? And told me to read their terms, if money wasent involved this would be laughable, They also told me to contact police if I think something been stolen. Wow been a Loyal customer buying Nikes since the early 90s that's over 30 years",March 24 2023,24/3/2023,Helpful (1),1,,,1,1,1,1,1,1
